{
    "title": "Talks on Zend Framework 1 to Zend Framework 2 and Website Optimisation",
    "description": "",
    "date": "10 October 2012",
    "meetup-id": "85545952",
    "start-time": "01:05",
    "end-time": "21:00",
    "talks": [],
    "venue": "golden-guinea",
    "pub": "",
    "organisers": [
        "kat-zien",
        "dave-liddament",
        "lee-stone",
        "oliver-davies"
    ],
    "sponsors": [
        "basekit",
        "brightpearl",
        "deep-blue-sky",
        "ents24",
        "equiniti",
        "meanbee"
    ],
    "joindin-url": "https:\/\/joind.in\/event\/phpsw-"
}