{
    "title": "Christmas Booze-up",
    "description": "<p>A chance to eat pizza, drink fine beer and be generally merry!<\/p> <p>Talks on:<\/p> <p>The Future of Humanity FuelPHP The Cleanest Code: or, Uncle Bob Driven Development (UBDD) <a href=\"http:\/\/brightpearl.com\/\">Brightpearl<\/a> have generously offered to sponsor this event, so it will be hosted in the Brightpearl offices (between Cabot Circus and Portland Square). There will be beer (free as in beer), pizza (also free as in beer) and assorted revelry.<\/p> <p>Places may be limited so please RSVP.<\/p> <p>\u00a0<\/p> <p><i>Driving to this event is not to be recommended.<\/i><\/p> ",
    "date": "12 December 2012",
    "meetup-id": "91339382",
    "start-time": "19:00",
    "end-time": "21:00",
    "talks": [],
    "venue": "brightpearl",
    "pub": "",
    "organisers": [
        "kat-zien",
        "dave-liddament",
        "lee-stone",
        "oliver-davies"
    ],
    "sponsors": [
        "basekit",
        "brightpearl",
        "deep-blue-sky",
        "ents24",
        "equiniti",
        "meanbee"
    ],
    "joindin-url": "https:\/\/joind.in\/event\/phpsw-"
}