{
    "title": "First meetup of the year",
    "description": "<p>There will be a talk on software design, OO stuff, unit testing with PHP examples.<\/p> <p>If anyone else would like to talk about something similar to the above or anything PHP, please contact me.<\/p> <p>Room is booked from 6.30pm. Talk will not start until after 7pm.<\/p> <p>\u00a0<\/p> <p>\u00a0<\/p> <p>\u00a0<\/p> <p>\u00a0<\/p> <p>\n\n\n\n\n\u00a0<\/p> <p>\u00a0<\/p> ",
    "date": "30 April 2013",
    "meetup-id": "114007332",
    "start-time": "05:05",
    "end-time": "21:00",
    "talks": [],
    "venue": "stag-and-hounds",
    "pub": "",
    "organisers": [
        "kat-zien",
        "dave-liddament",
        "lee-stone",
        "oliver-davies"
    ],
    "sponsors": [
        "basekit",
        "brightpearl",
        "deep-blue-sky",
        "ents24",
        "equiniti",
        "meanbee"
    ],
    "joindin-url": "https:\/\/joind.in\/event\/phpsw-"
}