{
    "title": "Social Night",
    "description": "<p>Meet up and talk about beer, how exciting May is going to be, and maybe even PHP too.<\/p> <p><a href=\"http:\/\/www.smallbarbristol.com\" class=\"linkified\">http:\/\/www.smallbarbristol.com<\/a><\/p> ",
    "date": "9 April 2014",
    "meetup-id": "168633652",
    "start-time": "01:04",
    "end-time": "21:00",
    "talks": [],
    "venue": "small-bar",
    "pub": "",
    "organisers": [
        "kat-zien",
        "dave-liddament",
        "lee-stone",
        "oliver-davies"
    ],
    "sponsors": [
        "basekit",
        "brightpearl",
        "deep-blue-sky",
        "ents24",
        "equiniti",
        "meanbee"
    ],
    "joindin-url": "https:\/\/joind.in\/event\/phpsw-"
}