{
    "title": "Talks on Zend Framework 2 and one other TBC",
    "description": "<p>We'll have one or two short talks. Plus the usual chat about PHP, general tech and whatever else.<\/p> ",
    "date": "8 February 2012",
    "meetup-id": "47790032",
    "start-time": "17:09",
    "end-time": "21:00",
    "talks": [],
    "venue": "golden-guinea",
    "pub": "",
    "organisers": [
        "kat-zien",
        "dave-liddament",
        "lee-stone",
        "oliver-davies"
    ],
    "sponsors": [
        "basekit",
        "brightpearl",
        "deep-blue-sky",
        "ents24",
        "equiniti",
        "meanbee"
    ],
    "joindin-url": "https:\/\/joind.in\/event\/phpsw-"
}