{
    "title": "Social Night",
    "description": "<p>Meet up and talk about beer and new years, and maybe even PHP too.<\/p> <p>Venue: Horts, Broad Street -\u00a0<a href=\"http:\/\/www.hortsbristol.com\" class=\"linkified\">http:\/\/www.hortsbristol.com<\/a><\/p> ",
    "date": "8 January 2014",
    "meetup-id": "156650922",
    "start-time": "17:03",
    "end-time": "21:00",
    "talks": [],
    "venue": "horts",
    "pub": "",
    "organisers": [
        "kat-zien",
        "dave-liddament",
        "lee-stone",
        "oliver-davies"
    ],
    "sponsors": [
        "basekit",
        "brightpearl",
        "deep-blue-sky",
        "ents24",
        "equiniti",
        "meanbee"
    ],
    "joindin-url": "https:\/\/joind.in\/event\/phpsw-"
}