{
    "title": "Talks on Javascript (Unit|Backbone) Testing and Symfony2",
    "description": "<p><b>Javascript Testing<\/b> (Andrew Martin)<\/p> <p>JS Unit Testing: The State of the Art Backbone Model\/View\u00a0Testing \u00a0<\/p> <p><b>Symfony2<\/b> (Dom Udall)<\/p> <p>Symfony2: An Overview \u00a0<\/p> <p>To be preceded, followed and interrupted by beer, Mexico's finest chilli and vocal dissent.<\/p> ",
    "date": "11 April 2012",
    "meetup-id": "58053142",
    "start-time": "01:01",
    "end-time": "21:00",
    "talks": [],
    "venue": "golden-guinea",
    "pub": "",
    "organisers": [
        "kat-zien",
        "dave-liddament",
        "lee-stone",
        "oliver-davies"
    ],
    "sponsors": [
        "basekit",
        "brightpearl",
        "deep-blue-sky",
        "ents24",
        "equiniti",
        "meanbee"
    ],
    "joindin-url": "https:\/\/joind.in\/event\/phpsw-"
}