{
    "title": "Profiling and debugging PHP",
    "description": "<p>Talks on PHP profiling and debugging<\/p> ",
    "date": "20 June 2012",
    "meetup-id": "65851242",
    "start-time": "01:09",
    "end-time": "21:00",
    "talks": [],
    "venue": "golden-guinea",
    "pub": "",
    "organisers": [
        "kat-zien",
        "dave-liddament",
        "lee-stone",
        "oliver-davies"
    ],
    "sponsors": [
        "basekit",
        "brightpearl",
        "deep-blue-sky",
        "ents24",
        "equiniti",
        "meanbee"
    ],
    "joindin-url": "https:\/\/joind.in\/event\/phpsw-"
}