{
    "title": "Meetup - Social & PHP chat",
    "description": "<p>Hi Adrian &amp; All,<\/p> <p>Wanted to suggest a social\/ chance to talk PHP.<br\/>Hope this is ok.<\/p> <p>Best wishes,<br\/>Indu<\/p> ",
    "date": "3 April 2013",
    "meetup-id": "109724772",
    "start-time": "20:00",
    "end-time": "21:00",
    "talks": [],
    "venue": "king-william",
    "pub": "",
    "organisers": [
        "kat-zien",
        "dave-liddament",
        "lee-stone",
        "oliver-davies"
    ],
    "sponsors": [
        "basekit",
        "brightpearl",
        "deep-blue-sky",
        "ents24",
        "equiniti",
        "meanbee"
    ],
    "joindin-url": "https:\/\/joind.in\/event\/phpsw-"
}