{
  "description" : "In November we present 'The Final Pipeline' (sung to the tune of the final countdown...) ",
  "date" : "November 2017",
  "meetup-id" : "244528361",
  "organisers" : [
    "lee-stone",
    "dave-liddament",
    "kat-zien",
    "oliver-davies"
  ],
  "pub" : "volunteer-tavern",
  "venue" : "basekit",
  "sponsors" : [
    "basekit",
    "brightpearl",
    "deep-blue-sky",
    "ents24",
    "equiniti",
    "meanbee"
  ],
  "title" : "The Final Pipeline"
}